{
  "schemaVersion": "1",
  "kind": "information-system",
  "convention": "scott-1982-distinguished-token",
  "id": "take-away-game",
  "title": "Take-away game",
  "description": "Win and loss claims about a take-1-or-2 stones game, bounded at 4 stones.",
  "approximation": {
    "kind": "bounded",
    "bound": "4"
  },
  "tokens": [
    {
      "id": "delta",
      "label": "Always-present token",
      "symbol": "Δ",
      "description": "The distinguished token present in every state."
    },
    {
      "id": "loss-0",
      "label": "0 is a loss",
      "symbol": "L0",
      "description": "With 0 stones, the player to move loses."
    },
    {
      "id": "loss-1",
      "label": "1 is a loss",
      "symbol": "L1",
      "description": "With 1 stone, the player to move loses."
    },
    {
      "id": "loss-2",
      "label": "2 is a loss",
      "symbol": "L2",
      "description": "With 2 stones, the player to move loses."
    },
    {
      "id": "loss-3",
      "label": "3 is a loss",
      "symbol": "L3",
      "description": "With 3 stones, the player to move loses."
    },
    {
      "id": "loss-4",
      "label": "4 is a loss",
      "symbol": "L4",
      "description": "With 4 stones, the player to move loses."
    },
    {
      "id": "win-0",
      "label": "0 is a win",
      "symbol": "W0",
      "description": "With 0 stones, the player to move wins."
    },
    {
      "id": "win-1",
      "label": "1 is a win",
      "symbol": "W1",
      "description": "With 1 stone, the player to move wins."
    },
    {
      "id": "win-2",
      "label": "2 is a win",
      "symbol": "W2",
      "description": "With 2 stones, the player to move wins."
    },
    {
      "id": "win-3",
      "label": "3 is a win",
      "symbol": "W3",
      "description": "With 3 stones, the player to move wins."
    },
    {
      "id": "win-4",
      "label": "4 is a win",
      "symbol": "W4",
      "description": "With 4 stones, the player to move wins."
    }
  ],
  "delta": "delta",
  "minimalInconsistentSets": [
    ["loss-0", "win-0"],
    ["loss-1", "win-1"],
    ["loss-2", "win-2"],
    ["loss-3", "win-3"],
    ["loss-4", "win-4"]
  ],
  "entailmentRules": []
}
